{
  "entity_id": "pixrask",
  "state": "idle",
  "facing": "left",
  "canvas": [
    256,
    256
  ],
  "baseline_y": 224,
  "pivot": [
    128,
    224
  ],
  "runtime_size": [
    56,
    56
  ],
  "cosmetic_only": true,
  "ground_or_hover_point": [
    117.89,
    224
  ],
  "body_filename": "pixrask_idle_left.png",
  "source_sha256": "3ad520a716d8cc3edf0f2ce7381614ac73fb9a73ffc417e286140597ef3734d0"
}
