{
  "entity_id": "puffnest",
  "state": "reaction",
  "facing": "right",
  "canvas": [
    256,
    256
  ],
  "baseline_y": 224,
  "pivot": [
    128,
    224
  ],
  "runtime_size": [
    56,
    56
  ],
  "cosmetic_only": true,
  "ground_or_hover_point": [
    153.5,
    224
  ],
  "body_filename": "puffnest_reaction_right.png",
  "source_sha256": "55bfbb41fb2c129b3406f4ab08e3b8b927071c843cb894edf7e6d30a41aa1ed3"
}
