{
  "entity_id": "stonekith",
  "state": "move",
  "facing": "left",
  "canvas": [
    256,
    256
  ],
  "baseline_y": 224,
  "pivot": [
    128,
    224
  ],
  "runtime_size": [
    56,
    56
  ],
  "cosmetic_only": true,
  "ground_or_hover_point": [
    96.17,
    224
  ],
  "body_filename": "stonekith_move_left.png",
  "source_sha256": "7f76e8c191030f3095e6570c7a6a2fcc3379b82b2592c0971aa85e9a71911976"
}
