{
  "entity_id": "pixrask",
  "state": "move",
  "facing": "right",
  "canvas": [
    256,
    256
  ],
  "baseline_y": 224,
  "pivot": [
    128,
    224
  ],
  "runtime_size": [
    56,
    56
  ],
  "cosmetic_only": true,
  "ground_or_hover_point": [
    136.0,
    224
  ],
  "body_filename": "pixrask_move_right.png",
  "source_sha256": "b54ea28d94bc9eded57689419bb57eeec36c845d221b0fd5f787f8934a5c59b7"
}
