{
  "entity_id": "breezewyn",
  "state": "idle",
  "facing": "right",
  "canvas": [
    256,
    256
  ],
  "baseline_y": 224,
  "pivot": [
    128,
    224
  ],
  "runtime_size": [
    56,
    56
  ],
  "cosmetic_only": true,
  "ground_or_hover_point": [
    99.5,
    224
  ],
  "body_filename": "breezewyn_idle_right.png",
  "source_sha256": "bd057beaf0f3b0761a2a2d15aaba5a9bbcd702be21e77190e177afcc0b459b0c"
}
