{
  "entity_id": "stonekith",
  "state": "idle",
  "facing": "left",
  "canvas": [
    256,
    256
  ],
  "baseline_y": 224,
  "pivot": [
    128,
    224
  ],
  "runtime_size": [
    56,
    56
  ],
  "cosmetic_only": true,
  "ground_or_hover_point": [
    105.83,
    224
  ],
  "body_filename": "stonekith_idle_left.png",
  "source_sha256": "ae71942c1935b2d1880281331a8e7fd498bced09deb7ee5cd810b0588456dac7"
}
