{
  "entity_id": "lunarwisp",
  "state": "reaction",
  "facing": "left",
  "canvas": [
    256,
    256
  ],
  "baseline_y": 224,
  "pivot": [
    128,
    224
  ],
  "runtime_size": [
    56,
    56
  ],
  "cosmetic_only": true,
  "ground_or_hover_point": [
    143.5,
    224
  ],
  "body_filename": "lunarwisp_reaction_left.png",
  "source_sha256": "6216e466a7b5a6a4b3854e783a411ee55fdb4d43e654d1d84b1430c751372a41"
}
